{
  "$schema": "https://json-schema.org/draft/2020-12/schema",
  "$id": "https://ois.foundation/schemas/ois-core/authentication.schema.json",
  "title": "OIS Core Authentication Profile",
  "type": "object",
  "additionalProperties": false,
  "required": [
    "oisVersion",
    "provider",
    "authentication",
    "security",
    "compliance"
  ],
  "properties": {
    "oisVersion": { "type": "string" },
    "provider": {
      "type": "object",
      "additionalProperties": false,
      "required": ["id", "capabilities", "endpoint"],
      "properties": {
        "id": { "type": "string" },
        "capabilities": {
          "type": "array",
          "minItems": 1,
          "items": {
            "type": "string",
            "enum": [
              "ois-core",
              "ois-display",
              "ois-media",
              "ois-proof-of-play",
              "ois-sense",
              "ois-location",
              "ois-events",
              "ois-commerce"
            ]
          }
        },
        "endpoint": { "type": "string", "format": "uri" }
      }
    },
    "authentication": {
      "type": "object",
      "additionalProperties": false,
      "required": ["type", "tokenEndpoint", "scopes"],
      "properties": {
        "type": { "type": "string", "enum": ["oauth2"] },
        "tokenEndpoint": { "type": "string", "format": "uri" },
        "scopes": {
          "type": "array",
          "minItems": 1,
          "items": { "type": "string" }
        }
      }
    },
    "security": {
      "type": "object",
      "additionalProperties": false,
      "required": ["transport", "signing"],
      "properties": {
        "transport": { "type": "string", "enum": ["TLS1.2", "TLS1.3"] },
        "signing": { "type": "string" }
      }
    },
    "compliance": {
      "type": "object",
      "additionalProperties": false,
      "required": ["certification", "lastValidated"],
      "properties": {
        "certification": { "type": "string", "enum": ["OIS-Core"] },
        "lastValidated": { "type": "string", "format": "date-time" }
      }
    }
  }
}
